{
  "$schema": "https://json-schema.org/draft/2020-12/schema",
  "$id": "https://www.cryp-iq.com/schemas/glossary-term.schema.json",
  "title": "CryptiQ glossary term",
  "description": "One post-quantum cryptography glossary entry. Rendered by src/pages/GlossaryTerm.jsx and prerendered to static HTML by scripts/prerender.mjs. Validated by scripts/validate-content.mjs before every build.",
  "type": "object",
  "required": [
    "slug",
    "term",
    "category",
    "shortDefinition",
    "definition",
    "sections",
    "faq",
    "related",
    "sources",
    "cryptiqAngle",
    "datePublished",
    "dateModified"
  ],
  "additionalProperties": false,
  "properties": {
    "slug": {
      "type": "string",
      "pattern": "^[a-z0-9]+(-[a-z0-9]+)*$",
      "description": "URL segment under /glossary/. Must equal the filename without .json."
    },
    "term": {
      "type": "string",
      "minLength": 2,
      "maxLength": 80,
      "description": "Canonical display name. Use final NIST names (ML-KEM, ML-DSA, SLH-DSA) — never CRYSTALS-* as the primary name."
    },
    "acronym": {
      "type": "string",
      "maxLength": 120,
      "description": "Spelled-out form when the term is an abbreviation (e.g. 'Module-Lattice-Based Key-Encapsulation Mechanism')."
    },
    "aliases": {
      "type": "array",
      "maxItems": 6,
      "items": { "type": "string", "maxLength": 80 },
      "description": "Former or alternate names (e.g. CRYSTALS-Kyber). Used for schema.org alternateName."
    },
    "category": {
      "enum": ["threat", "standard", "algorithm", "foundation", "at-risk", "migration"]
    },
    "shortDefinition": {
      "type": "string",
      "minLength": 70,
      "maxLength": 165,
      "description": "One-sentence definition. Doubles as the meta description — front-load the term and keep under 165 chars."
    },
    "definition": {
      "type": "array",
      "minItems": 2,
      "maxItems": 4,
      "items": { "type": "string", "minLength": 120 },
      "description": "Lead paragraphs. First sentence of the first paragraph must define the term outright."
    },
    "sections": {
      "type": "array",
      "minItems": 2,
      "maxItems": 5,
      "items": {
        "type": "object",
        "required": ["heading", "paragraphs"],
        "additionalProperties": false,
        "properties": {
          "heading": { "type": "string", "minLength": 4, "maxLength": 80 },
          "paragraphs": {
            "type": "array",
            "minItems": 1,
            "maxItems": 4,
            "items": { "type": "string", "minLength": 80 }
          },
          "bullets": {
            "type": "array",
            "minItems": 2,
            "maxItems": 8,
            "items": { "type": "string", "minLength": 10, "maxLength": 300 }
          }
        }
      }
    },
    "faq": {
      "type": "array",
      "minItems": 3,
      "maxItems": 6,
      "items": {
        "type": "object",
        "required": ["question", "answer"],
        "additionalProperties": false,
        "properties": {
          "question": { "type": "string", "minLength": 10, "maxLength": 120 },
          "answer": { "type": "string", "minLength": 80, "maxLength": 600 }
        }
      },
      "description": "Real questions practitioners ask. Emitted as FAQPage JSON-LD."
    },
    "related": {
      "type": "array",
      "minItems": 3,
      "maxItems": 6,
      "items": { "type": "string", "pattern": "^[a-z0-9]+(-[a-z0-9]+)*$" },
      "description": "Slugs of other glossary entries. Every slug must exist — enforced by the validator."
    },
    "sources": {
      "type": "array",
      "minItems": 2,
      "maxItems": 6,
      "items": {
        "type": "object",
        "required": ["title", "url"],
        "additionalProperties": false,
        "properties": {
          "title": { "type": "string", "minLength": 4, "maxLength": 160 },
          "url": { "type": "string", "pattern": "^https://" },
          "publisher": { "type": "string", "maxLength": 80 }
        }
      },
      "description": "Authoritative references only (NIST, CISA, NSA, IETF, vendor engineering blogs). Real URLs — verified during review."
    },
    "cryptiqAngle": {
      "type": "string",
      "minLength": 120,
      "maxLength": 600,
      "description": "How the term connects to cryptographic inventory / CBOM / migration work. Factual tone, not sales copy."
    },
    "datePublished": { "type": "string", "format": "date" },
    "dateModified": { "type": "string", "format": "date" }
  }
}
